{
  "summary": "gate INCOMPLETE | findings 3 | blocking 0 | claims reviewed 4 of 4 | run SYN-VAL-9475fd49eb71",
  "gate_recommendation": "INCOMPLETE",
  "gate_recommendation_note": "Recommendation only; not a clearance or approval; effect on progress not decided (GD-01 open).",
  "coverage": {
    "packs_in_scope": 1,
    "packs_reviewed": 1,
    "claims_in_pack": 4,
    "claims_reviewed": 4,
    "sampling_rule_ref": null
  },
  "manifest_declarations": {
    "produced_by": "Definition & CDE Agent",
    "authored_by": "Definition & CDE Agent",
    "assembled_by": "SYN-ROLE-ASSEMBLER",
    "manifest_approved_by": "SYN-ROLE-MANIFEST-APPROVER",
    "uncited_evidence_ids": [],
    "provenance": "synthetic"
  },
  "deterministic_checks_consumed": [
    { "check": "output_schema", "run_id": "SYN-VAL-9475fd49eb71", "result": "pass" },
    { "check": "duplicate_and_unresolved_evidence_ids", "run_id": "SYN-VAL-9475fd49eb71", "result": "pass" },
    { "check": "boundary", "run_id": "SYN-VAL-9475fd49eb71", "result": "pass" },
    { "check": "approval_log_extract", "run_id": "SYN-APPR-014183abb60d", "result": "pass" }
  ],
  "uncited_evidence_dispositions": [],
  "findings": [
    {
      "finding_id": "AR-AR-RUN2-A2-001",
      "finding_type": "evidence_gap",
      "blocking": false,
      "source_claim_id": null,
      "evidence_ids": [],
      "locations": ["manifest.json items"],
      "quoted_excerpt": "\"items\": [",
      "action_required": "REQUEST_EVIDENCE: named_packet_item manifest.json items (governing documents and producer Agent Contract not listed)",
      "contested": false
    },
    {
      "finding_id": "AR-AR-RUN2-A2-002",
      "finding_type": "evidence_gap",
      "blocking": false,
      "source_claim_id": null,
      "evidence_ids": [],
      "locations": [
        "manifest.json case_id",
        "pack/producer-output.json@4b1ca15e61aa handoff.case_id"
      ],
      "quoted_excerpt": "\"case_id\": \"EVAL-S04-P3\",",
      "action_required": "REQUEST_EVIDENCE: manifest_field manifest.json case_id",
      "contested": false
    },
    {
      "finding_id": "AR-AR-RUN2-A2-003",
      "finding_type": "evidence_gap",
      "blocking": false,
      "source_claim_id": null,
      "evidence_ids": ["GL-401"],
      "locations": [
        "pack/producer-output.json@4b1ca15e61aa handoff.findings[0]",
        "evidence/GL-401.json@84cdc61261c2 extracted_fact"
      ],
      "quoted_excerpt": "GL-401 'Counterparty Tier' exists in the glossary with status Draft, version 0.2, category CAT-CPTY.",
      "action_required": "REQUEST_EVIDENCE: evidence_record evidence/GL-401.json extracted_fact",
      "contested": false
    }
  ],
  "reviewed_claims": [
    {
      "source_claim_id": "C1",
      "producer_claim_assessment": "Supported",
      "finding_ids": [],
      "evidence": [
        {
          "authority_level": "authoritative_internal",
          "direct_or_inferred": "direct",
          "extracted_fact": "Term 'Counterparty Tier'; definition: 'The internal grouping of a counterparty by credit and relationship standing.'; owner not recorded; status Draft; version 0.2; recorded_cde_flag false.",
          "location": "SYNTH-GLOSSARY/GL-401",
          "source_id": "GL-401",
          "source_type": "glossary_term",
          "timestamp": "2026-10-28T00:00:00Z",
          "title": "Counterparty Tier"
        }
      ],
      "assumption_excerpts": [
        "Absence of an owner field is read as 'no owner recorded in this glossary content', not as proof that no owner exists elsewhere (for example in an unrecorded register)."
      ],
      "action_required": "REQUEST_EVIDENCE: named_packet_item manifest.json items (governing documents and producer Agent Contract not listed)"
    },
    {
      "source_claim_id": "C2",
      "producer_claim_assessment": "Supported",
      "finding_ids": [],
      "evidence": [
        {
          "authority_level": "authoritative_internal",
          "direct_or_inferred": "direct",
          "extracted_fact": "Term 'Counterparty Tier'; definition: 'The internal grouping of a counterparty by credit and relationship standing.'; owner not recorded; status Draft; version 0.2; recorded_cde_flag false.",
          "location": "SYNTH-GLOSSARY/GL-401",
          "source_id": "GL-401",
          "source_type": "glossary_term",
          "timestamp": "2026-10-28T00:00:00Z",
          "title": "Counterparty Tier"
        }
      ],
      "assumption_excerpts": [],
      "action_required": "REQUEST_EVIDENCE: named_packet_item manifest.json items (governing documents and producer Agent Contract not listed)"
    },
    {
      "source_claim_id": "C3",
      "producer_claim_assessment": "Unable to determine",
      "finding_ids": [],
      "evidence": [],
      "assumption_excerpts": [],
      "action_required": "REQUEST_EVIDENCE: named_packet_item manifest.json items (governing documents and producer Agent Contract not listed)"
    },
    {
      "source_claim_id": "C4",
      "producer_claim_assessment": "Unable to determine",
      "finding_ids": [],
      "evidence": [],
      "assumption_excerpts": [],
      "action_required": "REQUEST_EVIDENCE: named_packet_item manifest.json items (governing documents and producer Agent Contract not listed)"
    }
  ],
  "boundary_check": "consistent",
  "approval_check": "consistent",
  "contradictions": [],
  "evidence_requests": [
    "REQUEST_EVIDENCE: named_packet_item GOVERNANCE-DECISIONS.md",
    "REQUEST_EVIDENCE: named_packet_item docs/STEWARDSHIP-FRAMEWORK.md",
    "REQUEST_EVIDENCE: contract_clause Definition & CDE Agent approved Agent Contract",
    "REQUEST_EVIDENCE: manifest_field manifest.json case_id",
    "REQUEST_EVIDENCE: evidence_record evidence/GL-401.json extracted_fact"
  ],
  "contested_findings": [],
  "assumptions": [
    "Absence of an owner field is read as 'no owner recorded in this glossary content', not as proof that no owner exists elsewhere (for example in an unrecorded register).",
    "The glossary file fixtures/definition-and-cde/glossary.json is treated as the sole available glossary content for this run; no live glossary or catalog system is connected."
  ],
  "open_questions": [
    "REQUEST_EVIDENCE: contract_clause handoff.claims.statement form"
  ],
  "recommendations": [
    "HUMAN_ACTION: Data Steward supply_packet_item"
  ],
  "human_action_required": [
    "HUMAN_ACTION: Data Steward supply_packet_item"
  ],
  "handoff": {
    "case_id": "AR-RUN2",
    "request": "Who owns the glossary entry GL-401 for 'Counterparty Tier'?",
    "agent": "Assurance Reviewer",
    "status": "escalated",
    "findings": [
      "AR-AR-RUN2-A2-GATE | INCOMPLETE | SYN-VAL-9475fd49eb71 | recommendation, not a clearance",
      "AR-AR-RUN2-A2-001 | evidence_gap | false | null | manifest.json items",
      "AR-AR-RUN2-A2-002 | evidence_gap | false | null | manifest.json case_id; pack/producer-output.json@4b1ca15e61aa handoff.case_id",
      "AR-AR-RUN2-A2-003 | evidence_gap | false | null | pack/producer-output.json@4b1ca15e61aa handoff.findings[0]; evidence/GL-401.json@84cdc61261c2 extracted_fact"
    ],
    "evidence": [
      {
        "authority_level": "authoritative_internal",
        "direct_or_inferred": "direct",
        "extracted_fact": "Term 'Counterparty Tier'; definition: 'The internal grouping of a counterparty by credit and relationship standing.'; owner not recorded; status Draft; version 0.2; recorded_cde_flag false.",
        "location": "SYNTH-GLOSSARY/GL-401",
        "source_id": "GL-401",
        "source_type": "glossary_term",
        "timestamp": "2026-10-28T00:00:00Z",
        "title": "Counterparty Tier"
      },
      {
        "authority_level": "authoritative_internal",
        "direct_or_inferred": "direct",
        "extracted_fact": "\"result\": \"pass\"",
        "location": "checks/validator-report.json@63f14c67a383 line 17 (checks[2].result, check boundary)",
        "source_id": "AR-EV-VAL-SYN-VAL-9475fd49eb71",
        "source_type": "validator_report",
        "timestamp": "not recorded in packet",
        "title": "SYN-VAL-9475fd49eb71"
      }
    ],
    "claims": [
      {
        "claim_id": "AR-C-GATE",
        "statement": "AR-AR-RUN2-A2-GATE | INCOMPLETE | SYN-VAL-9475fd49eb71 | recommendation, not a clearance",
        "claim_type": "agent_inference",
        "confidence": "Unable to determine",
        "evidence_ids": []
      },
      {
        "claim_id": "AR-C-AR-AR-RUN2-A2-001",
        "statement": "AR-AR-RUN2-A2-001 | evidence_gap | false | null | manifest.json items",
        "claim_type": "agent_inference",
        "confidence": "Unable to determine",
        "evidence_ids": []
      },
      {
        "claim_id": "AR-C-AR-AR-RUN2-A2-002",
        "statement": "AR-AR-RUN2-A2-002 | evidence_gap | false | null | manifest.json case_id; pack/producer-output.json@4b1ca15e61aa handoff.case_id",
        "claim_type": "agent_inference",
        "confidence": "Unable to determine",
        "evidence_ids": []
      },
      {
        "claim_id": "AR-C-AR-AR-RUN2-A2-003",
        "statement": "AR-AR-RUN2-A2-003 | evidence_gap | false | null | pack/producer-output.json@4b1ca15e61aa handoff.findings[0]; evidence/GL-401.json@84cdc61261c2 extracted_fact",
        "claim_type": "agent_inference",
        "confidence": "Partially supported",
        "evidence_ids": ["GL-401"]
      }
    ],
    "assumptions": [
      "Absence of an owner field is read as 'no owner recorded in this glossary content', not as proof that no owner exists elsewhere (for example in an unrecorded register).",
      "The glossary file fixtures/definition-and-cde/glossary.json is treated as the sole available glossary content for this run; no live glossary or catalog system is connected."
    ],
    "open_questions": [
      "REQUEST_EVIDENCE: contract_clause handoff.claims.statement form"
    ],
    "human_action_required": [
      "HUMAN_ACTION: Data Steward supply_packet_item"
    ],
    "next_agent": null
  }
}
